mysql> select 10 + 20
    -> select 10 + 20 ;
ERROR 1064 (42000): You have an error in your SQL syntax; check the manual that corresponds to your MySQL server version for the right syntax to use near 'select 10 + 20' at line 2
mysql> select 10 + 20 ;;
+---------+
| 10 + 20 |
+---------+
|      30 |
+---------+
1 row in set (0.00 sec)

ERROR:
No query specified

mysql> select 10 - 20;
+---------+
| 10 - 20 |
+---------+
|     -10 |
+---------+
1 row in set (0.00 sec)

mysql> select 10 * 20;
+---------+
| 10 * 20 |
+---------+
|     200 |
+---------+
1 row in set (0.00 sec)

mysql> select 10 / 20;
+---------+
| 10 / 20 |
+---------+
|  0.5000 |
+---------+
1 row in set (0.00 sec)

mysql> select 10 % 20;
+---------+
| 10 % 20 |
+---------+
|      10 |
+---------+
1 row in set (0.00 sec)

mysql> select 10 % 20;
+---------+
| 10 % 20 |
+---------+
|      10 |
+---------+
1 row in set (0.00 sec)

mysql> create table customers ( id int, name varchar(30), age int, address varchar(30), salary int, primary key id);
ERROR 1064 (42000): You have an error in your SQL syntax; check the manual that corresponds to your MySQL server version for the right syntax to use near ')' at line 1
mysql> create table customers ( id int, name varchar(30), age int, address varchar(30), salary int, primary key (id) );
ERROR 1046 (3D000): No database selected
mysql> show databases;
+--------------------+
| Database           |
+--------------------+
| information_schema |
| mysql              |
| nit                |
| performance_schema |
| sys                |
+--------------------+
5 rows in set (0.01 sec)

mysql> use nit
Database changed
mysql> create table customers ( id int, name varchar(30), age int, address varchar(30), salary int, primary key (id) );
Query OK, 0 rows affected (0.04 sec)

mysql> show tables;
+---------------+
| Tables_in_nit |
+---------------+
| customers     |
| emp           |
| student       |
+---------------+
3 rows in set (0.00 sec)

mysql> select * from customers;
Empty set (0.00 sec)

mysql> insert into customers ( id, name, age, address, salary) values (29,'naval',38,'canada',39000), (19,'vijay',21, 'chennai',29000), (89, 'sherry',23,'usa',45900);
Query OK, 3 rows affected (0.01 sec)
Records: 3  Duplicates: 0  Warnings: 0

mysql> select * from customers;
+----+--------+------+---------+--------+
| id | name   | age  | address | salary |
+----+--------+------+---------+--------+
| 19 | vijay  |   21 | chennai |  29000 |
| 29 | naval  |   38 | canada  |  39000 |
| 89 | sherry |   23 | usa     |  45900 |
+----+--------+------+---------+--------+
3 rows in set (0.00 sec)

mysql> select * from customers where salary > 5000;
+----+--------+------+---------+--------+
| id | name   | age  | address | salary |
+----+--------+------+---------+--------+
| 19 | vijay  |   21 | chennai |  29000 |
| 29 | naval  |   38 | canada  |  39000 |
| 89 | sherry |   23 | usa     |  45900 |
+----+--------+------+---------+--------+
3 rows in set (0.00 sec)

mysql> select * from customers where salary > 40000;
+----+--------+------+---------+--------+
| id | name   | age  | address | salary |
+----+--------+------+---------+--------+
| 89 | sherry |   23 | usa     |  45900 |
+----+--------+------+---------+--------+
1 row in set (0.00 sec)

mysql> select * from customers where age >= 25 and salary >= 10000;
+----+-------+------+---------+--------+
| id | name  | age  | address | salary |
+----+-------+------+---------+--------+
| 29 | naval |   38 | canada  |  39000 |
+----+-------+------+---------+--------+
1 row in set (0.00 sec)

mysql> select * from customers where age >= 25 or salary >= 10000;
+----+--------+------+---------+--------+
| id | name   | age  | address | salary |
+----+--------+------+---------+--------+
| 19 | vijay  |   21 | chennai |  29000 |
| 29 | naval  |   38 | canada  |  39000 |
| 89 | sherry |   23 | usa     |  45900 |
+----+--------+------+---------+--------+
3 rows in set (0.00 sec)

mysql> select * from customers where age is not null;
+----+--------+------+---------+--------+
| id | name   | age  | address | salary |
+----+--------+------+---------+--------+
| 19 | vijay  |   21 | chennai |  29000 |
| 29 | naval  |   38 | canada  |  39000 |
| 89 | sherry |   23 | usa     |  45900 |
+----+--------+------+---------+--------+
3 rows in set (0.00 sec)

mysql> select * from customers where salary = 30000;
Empty set (0.00 sec)

mysql> select numerical_expression as operation_name
    -> [from table customer where age > 21];
ERROR 1064 (42000): You have an error in your SQL syntax; check the manual that corresponds to your MySQL server version for the right syntax to use near '[from table customer where age > 21]' at line 2
mysql> select current_timestamp;
+---------------------+
| current_timestamp   |
+---------------------+
| 2026-09-12 01:37:40 |
+---------------------+
1 row in set (0.00 sec)

mysql> select count(*) as "records" from customers;
+---------+
| records |
+---------+
|       3 |
+---------+
1 row in set (0.01 sec)

mysql> select getdate();;
ERROR 1305 (42000): FUNCTION nit.getdate does not exist
ERROR:
No query specified

mysql> select getdate();
ERROR 1305 (42000): FUNCTION nit.getdate does not exist
mysql> create database testdb;
Query OK, 1 row affected (0.01 sec)

mysql> show databases;
+--------------------+
| Database           |
+--------------------+
| information_schema |
| mysql              |
| nit                |
| performance_schema |
| sys                |
| testdb             |
+--------------------+
6 rows in set (0.00 sec)

mysql> drop database testdb;
Query OK, 0 rows affected (0.01 sec)

mysql> show databases;
+--------------------+
| Database           |
+--------------------+
| information_schema |
| mysql              |
| nit                |
| performance_schema |
| sys                |
+--------------------+
5 rows in set (0.00 sec)

mysql> create database personal;
Query OK, 1 row affected (0.01 sec)

mysql> use personal;
Database changed
mysql> create table books;
ERROR 4028 (HY000): A table must have at least one visible column.
mysql> create table books ( name char (30) primary key, price int not null, type varchar(20));
Query OK, 0 rows affected (0.03 sec)

mysql> insert into books ( name, price, type) values ( '48 laws of power', 399, 'motivational'), ('think strainght', 299, 'selfhelp'), ('almanack', 399,'selfhelp');
Query OK, 3 rows affected (0.01 sec)
Records: 3  Duplicates: 0  Warnings: 0

mysql> select price from books;
+-------+
| price |
+-------+
|   399 |
|   399 |
|   299 |
+-------+
3 rows in set (0.00 sec)

mysql> select name , price from books;
+------------------+-------+
| name             | price |
+------------------+-------+
| 48 laws of power |   399 |
| almanack         |   399 |
| think strainght  |   299 |
+------------------+-------+
3 rows in set (0.00 sec)

mysql> select name from books where price > 199;
+------------------+
| name             |
+------------------+
| 48 laws of power |
| almanack         |
| think strainght  |
+------------------+
3 rows in set (0.00 sec)

mysql> select name from books where price > 299;
+------------------+
| name             |
+------------------+
| 48 laws of power |
| almanack         |
+------------------+
2 rows in set (0.00 sec)

mysql> update books set price = 199 where name = 'almanack';
Query OK, 1 row affected (0.00 sec)
Rows matched: 1  Changed: 1  Warnings: 0

mysql> select * from books
    -> select * from books;
ERROR 1064 (42000): You have an error in your SQL syntax; check the manual that corresponds to your MySQL server version for the right syntax to use near 'select * from books' at line 2
mysql> select * from books;
+------------------+-------+--------------+
| name             | price | type         |
+------------------+-------+--------------+
| 48 laws of power |   399 | motivational |
| almanack         |   199 | selfhelp     |
| think strainght  |   299 | selfhelp     |
+------------------+-------+--------------+
3 rows in set (0.00 sec)

mysql> select name from books order by price;
+------------------+
| name             |
+------------------+
| almanack         |
| think strainght  |
| 48 laws of power |
+------------------+
3 rows in set (0.00 sec)

mysql> select name from books order by price desc;
+------------------+
| name             |
+------------------+
| 48 laws of power |
| think strainght  |
| almanack         |
+------------------+
3 rows in set (0.00 sec)

mysql>